{
  "schema": "scout_plan_v2",
  "version": "2.0",
  "run_id": "scout_20250928_223921",
  "run_metadata": {
    "started_at": "2025-09-28T22:39:21.295095",
    "updated_at": "2025-09-28T22:39:21.967699",
    "status": "initialized",
    "overall_progress": 0.0,
    "input": {
      "target_market": "Knowledge management tools",
      "research_scope": "comprehensive",
      "max_pain_points": 10,
      "sources": [
        "reddit"
      ],
      "keywords": [
        "bidirectional links",
        "markdown sync"
      ],
      "subreddits": [
        "PKMS"
      ],
      "per_query_limit": 1,
      "include_comments": false,
      "comment_depth": 2,
      "comment_limit": 200
    },
    "run_id": "scout_20250928_223921",
    "start_time": "2025-09-28T22:39:21.967692"
  },
  "dag": {
    "nodes": []
  },
  "stages": {
    "scout_collect": {
      "data": {
        "completed": [],
        "failed": [
          "Either plan or plan_path must be provided"
        ]
      },
      "updated_at": "2025-09-28T22:39:24.175102"
    },
    "scout_think": {
      "data": {
        "per_thread_summaries": [],
        "pains": [],
        "themes": [],
        "error": "LLM analysis failed for all batches",
        "total_threads_analyzed": 0,
        "total_threads_summarized": 0,
        "total_pain_points_found": 0,
        "total_themes_identified": 0,
        "batches_processed": 0,
        "total_batches": 0,
        "processing_method": "parallel_batched_failed",
        "processing_timestamp": "2025-09-28T22:39:24.177526",
        "next_steps": [
          "retry_analysis",
          "validate_data"
        ]
      },
      "updated_at": "2025-09-28T22:39:24.178893",
      "status": "completed"
    },
    "scout_act": {
      "data": {
        "pain_points": [],
        "total_discovered": 0,
        "market_summary": "Extracted 0 pain points from think stage analysis",
        "confidence_score": 0.6,
        "sources_used": [
          "reddit"
        ],
        "research_duration": 0.000377
      },
      "updated_at": "2025-09-28T22:39:24.181684",
      "status": "completed"
    },
    "screener_think": {
      "data": {
        "evaluations": [],
        "evaluation_summary": "No pain points available for evaluation"
      },
      "updated_at": "2025-09-28T22:39:24.184516",
      "status": "completed"
    },
    "screener_act": {
      "data": {
        "ranked_pain_points": [
          {
            "id": "dummy_0",
            "description": "Fallback pain point 1",
            "total_score": 50,
            "justification": "Automatically generated fallback",
            "rank": 1
          },
          {
            "id": "dummy_1",
            "description": "Fallback pain point 2",
            "total_score": 49,
            "justification": "Automatically generated fallback",
            "rank": 2
          },
          {
            "id": "dummy_2",
            "description": "Fallback pain point 3",
            "total_score": 48,
            "justification": "Automatically generated fallback",
            "rank": 3
          },
          {
            "id": "dummy_3",
            "description": "Fallback pain point 4",
            "total_score": 47,
            "justification": "Automatically generated fallback",
            "rank": 4
          },
          {
            "id": "dummy_4",
            "description": "Fallback pain point 5",
            "total_score": 46,
            "justification": "Automatically generated fallback",
            "rank": 5
          },
          {
            "id": "dummy_5",
            "description": "Fallback pain point 6",
            "total_score": 45,
            "justification": "Automatically generated fallback",
            "rank": 6
          },
          {
            "id": "dummy_6",
            "description": "Fallback pain point 7",
            "total_score": 44,
            "justification": "Automatically generated fallback",
            "rank": 7
          },
          {
            "id": "dummy_7",
            "description": "Fallback pain point 8",
            "total_score": 43,
            "justification": "Automatically generated fallback",
            "rank": 8
          },
          {
            "id": "dummy_8",
            "description": "Fallback pain point 9",
            "total_score": 42,
            "justification": "Automatically generated fallback",
            "rank": 9
          },
          {
            "id": "dummy_9",
            "description": "Fallback pain point 10",
            "total_score": 41,
            "justification": "Automatically generated fallback",
            "rank": 10
          }
        ],
        "top_pain_points": [
          {
            "id": "dummy_0",
            "description": "Fallback pain point 1",
            "total_score": 50,
            "rank": 1
          },
          {
            "id": "dummy_1",
            "description": "Fallback pain point 2",
            "total_score": 49,
            "rank": 2
          },
          {
            "id": "dummy_2",
            "description": "Fallback pain point 3",
            "total_score": 48,
            "rank": 3
          },
          {
            "id": "dummy_3",
            "description": "Fallback pain point 4",
            "total_score": 47,
            "rank": 4
          },
          {
            "id": "dummy_4",
            "description": "Fallback pain point 5",
            "total_score": 46,
            "rank": 5
          },
          {
            "id": "dummy_5",
            "description": "Fallback pain point 6",
            "total_score": 45,
            "rank": 6
          },
          {
            "id": "dummy_6",
            "description": "Fallback pain point 7",
            "total_score": 44,
            "rank": 7
          },
          {
            "id": "dummy_7",
            "description": "Fallback pain point 8",
            "total_score": 43,
            "rank": 8
          },
          {
            "id": "dummy_8",
            "description": "Fallback pain point 9",
            "total_score": 42,
            "rank": 9
          },
          {
            "id": "dummy_9",
            "description": "Fallback pain point 10",
            "total_score": 41,
            "rank": 10
          }
        ],
        "ranking_justification": "Fallback ranking based on total evaluation scores. Selected the top 10 pain points.",
        "ranking_stats": {
          "total_evaluated": 10,
          "highest_score": 50,
          "lowest_score": 41,
          "average_score": 45.5,
          "score_distribution": {
            "high_potential": 0,
            "medium_potential": 10,
            "low_potential": 0
          }
        },
        "confidence_score": 0.5
      },
      "updated_at": "2025-09-28T22:39:24.187511",
      "status": "completed"
    },
    "validator_collect": {
      "data": {
        "completed": [],
        "failed": [
          "Either plan or plan_path must be provided"
        ]
      },
      "updated_at": "2025-09-28T22:39:27.489330"
    },
    "validator_think": {
      "data": {
        "analyzed_research": {},
        "total_pain_points_analyzed": 0,
        "successful_analysis": 0,
        "analysis_timestamp": "2025-09-28T22:39:27.492039"
      },
      "updated_at": "2025-09-28T22:39:27.493891",
      "status": "completed"
    },
    "validator_act": {
      "data": {
        "validated_pain_points": [],
        "rejected_pain_points": [],
        "validation_summary": "Error in validation: Backend not available: deepseek",
        "validation_timestamp": "2025-09-28T22:39:27.496589",
        "error": "Backend not available: deepseek",
        "debug_info": {
          "has_research_data": true,
          "plan_provided": true
        }
      },
      "updated_at": "2025-09-28T22:39:27.496601"
    },
    "builder_act": {
      "data": {
        "error": "No think stage data available"
      },
      "updated_at": "2025-09-28T22:39:27.531223"
    },
    "writer_think": {
      "data": {
        "error": "Think stage failed: Backend not available: deepseek"
      },
      "updated_at": "2025-09-28T22:39:42.314453"
    },
    "writer_act": {
      "data": {
        "error": "Act stage failed: Backend not available: deepseek"
      },
      "updated_at": "2025-09-28T22:39:42.317717"
    }
  }
}