{
  "schema": "scout_plan_v2",
  "version": "2.0",
  "run_id": "test_collect_001",
  "run_metadata": {
    "started_at": "2025-08-16T23:08:32.890769",
    "updated_at": "2025-08-16T23:08:33.117752",
    "status": "completed",
    "overall_progress": 1.0,
    "progress": 0
  },
  "target_market": "",
  "time_window": "12m",
  "sources": [],
  "keywords": [],
  "subreddits": [],
  "limits": {},
  "dag": {
    "run_id": "test_collect_001",
    "nodes": [
      {
        "id": "write_manifest",
        "type": "tool",
        "language": "python",
        "code": "save_to_manifest(\"stages.write_manifest\", {\"hello\": \"world\"})",
        "outputs": {
          "location": "stages.write_manifest",
          "artifacts": []
        },
        "deps": [],
        "status": {
          "state": "completed",
          "started_at": "2025-08-16T23:08:32.890769",
          "updated_at": "2025-08-16T23:08:33.117463",
          "duration_seconds": 0,
          "attempts": 0,
          "retries_remaining": 3,
          "error": null
        },
        "metrics": {
          "tokens_used": 0,
          "cost": 0.0,
          "backend": null,
          "model": null,
          "duration_seconds": 0.2266378402709961
        }
      }
    ]
  },
  "stages": {
    "write_manifest": {
      "data": {
        "artifacts": []
      },
      "updated_at": "2025-08-16T23:08:33.117576",
      "status": "completed"
    }
  }
}